{
  "schema_version": "1.0.0-draft.1",
  "document_id": "urn:fyi-nz:document:demo-born-digital",
  "source_evidence_id": "urn:foi-process:evidence:sha256:aaaaaaaaaaaaaaaaaaaaaaaaaaaaaaaaaaaaaaaaaaaaaaaaaaaaaaaaaaaaaaaa",
  "source_sha256": "bbbbbbbbbbbbbbbbbbbbbbbbbbbbbbbbbbbbbbbbbbbbbbbbbbbbbbbbbbbbbbbb",
  "media_type": "application/pdf",
  "created_at": "2026-07-22T00:05:00Z",
  "extractor": {
    "name": "fe-reader-document-pipeline",
    "version": "0.1.0-draft",
    "runtime": "rust",
    "license": "MIT OR Apache-2.0"
  },
  "pages": [
    {
      "page_number": 1,
      "page_sha256": "cccccccccccccccccccccccccccccccccccccccccccccccccccccccccccccccc",
      "width": 595.0,
      "height": 842.0,
      "extraction_method": "born_digital",
      "quality_score": 1.0,
      "segments": [
        {
          "segment_id": "urn:foi-process:segment:sha256:dddddddddddddddddddddddddddddddddddddddddddddddddddddddddddddddd",
          "reading_order": 1,
          "text_sha256": "eeeeeeeeeeeeeeeeeeeeeeeeeeeeeeeeeeeeeeeeeeeeeeeeeeeeeeeeeeeeeeee",
          "character_count": 46,
          "text_blob_id": "urn:foi-process:text:sha256:ffffffffffffffffffffffffffffffffffffffffffffffffffffffffffffffff",
          "bbox": {
            "page": 1,
            "x": 72.0,
            "y": 110.0,
            "width": 420.0,
            "height": 24.0,
            "coordinate_system": "pdf_points_top_left"
          },
          "language": "en-NZ",
          "privacy": {
            "sensitivity": "public",
            "access_tier": "public",
            "disposition": "publish",
            "reason_codes": ["privacy:fixture_reviewed"],
            "human_reviewed": true
          }
        }
      ]
    }
  ],
  "privacy": {
    "sensitivity": "public",
    "access_tier": "public",
    "disposition": "publish",
    "reason_codes": ["privacy:fixture_reviewed"],
    "human_reviewed": true
  },
  "attributes": {
    "ocr_required": false
  }
}
