{
  "schema_version": "1.0.0-draft.1",
  "document_id": "urn:fyi-nz:document:demo-extension",
  "source_evidence_id": "urn:foi-process:evidence:sha256:916da5d65c80f9b71594a441cc7985fb547c7f27f03d727fc6cade23d8fff636",
  "source_sha256": "1bc5ba35cb9794ff3a9a5fbc49425f0c42c4f24594a4b999955984261bc5e566",
  "media_type": "application/pdf",
  "created_at": "2026-07-09T00:05:00Z",
  "extractor": {
    "name": "fe-reader-document-pipeline",
    "version": "0.1.0-draft",
    "runtime": "rust",
    "license": "MIT OR Apache-2.0"
  },
  "pages": [
    {
      "page_number": 1,
      "page_sha256": "f020fbe2900d40dd1a4b5d567bec8667045afdb918145b3a55aadac8402eb3ee",
      "width": 595.0,
      "height": 842.0,
      "extraction_method": "ocr",
      "model": {
        "name": "ocr-adapter",
        "version": "unselected",
        "runtime": "onnx",
        "license": "repository-license"
      },
      "quality_score": 0.94,
      "segments": [
        {
          "segment_id": "urn:foi-process:segment:sha256:afb29f0988a55aaa310f58c9f129a995eb2b283dbf5a192d1716ea691dfc3bff",
          "reading_order": 1,
          "text_sha256": "41571aea61d12cf784a6c677aeb34dd18352027acc56d33b4520003969e40783",
          "character_count": 46,
          "inline_text": "The time limit is extended by 15 working days.",
          "bbox": {
            "page": 1,
            "x": 72.0,
            "y": 110.0,
            "width": 420.0,
            "height": 24.0,
            "coordinate_system": "pdf_points_top_left"
          },
          "confidence": 0.94,
          "language": "en-NZ",
          "privacy": {
            "sensitivity": "public",
            "access_tier": "public",
            "disposition": "publish",
            "reason_codes": [
              "privacy:fixture_reviewed"
            ],
            "human_reviewed": true
          }
        }
      ]
    }
  ],
  "privacy": {
    "sensitivity": "public",
    "access_tier": "public",
    "disposition": "publish",
    "reason_codes": [
      "privacy:fixture_reviewed"
    ],
    "human_reviewed": true
  },
  "attributes": {
    "ocr_required": true
  }
}
